{
  "$schema": "tubelex-release-admission-candidate.schema.json",
  "schema_version": "0.3.0",
  "candidate_id": "tubelex-en-treebank-slim-7cb5fb36-public-profile-admission-v3",
  "candidate_state": "maintainer-approved",
  "resource": {
    "resource_id": "tubelex-en-treebank-slim",
    "resource_version": "7cb5fb36-slim-v1",
    "upstream_commit": "7cb5fb36add76b83a266d1967536e1a1d3faa513",
    "upstream_source_sha256": "4096022259d5eaa7261c3bf22c3b0af9fd58ae8eebe17894c0b34a163954f936",
    "manifest_sha256": "a0936c52cbeeccd807161e7236c8d01303819a968ee3be4d84e002966574bb1d",
    "artifact_sha256": "ded083e5b9f59ddfb719ebd88063778500cb347e1eab0f2d79ff55085d92fb4d",
    "content_sha256": "423dd4631c9da2f7442705d2930126da4cba980e46b6a5c0dda98336dce74916",
    "license_spdx": "BSD-3-Clause",
    "notice_path": "licenses/tubelex/NOTICE.md",
    "notice_sha256": "e65a1f5d0d6e7806e31e92d78bf3b903115e610c36bd9f2406269700441ecdd3"
  },
  "distribution_scope": {
    "package_component_state": "release-candidate",
    "raw_source_bundled": false,
    "raw_subtitles_or_identifiers_included": false,
    "runtime_network_access": false,
    "implicit_download_or_fallback": false,
    "public_api": true,
    "release_approved": true
  },
  "contract_refs": {
    "loader_contract_id": "ldfreq-lexical-sophistication-profile",
    "loader_contract_version": "0.1.1",
    "lookup_contract_id": "ldfreq-lexical-resource-lookup",
    "lookup_contract_version": "0.1.1",
    "lookup_result_schema_id": "lexres-frequency-prevalence-result",
    "lookup_result_schema_version": "0.1.1",
    "public_profile_contract_id": "ldfreq-tubelex-frequency-profile",
    "public_profile_contract_version": "0.1.0"
  },
  "admission_policy": {
    "decision_authority": "package-maintainer",
    "independent_reviewer_required": false,
    "optional_independent_review_permitted": true,
    "automated_identity_checks_required": true,
    "final_inventory_audit_required": true
  },
  "maintainer_decision": {
    "decision_id": "tubelex-maintainer-redistribution-decision-2026-08-06",
    "decision": "approved",
    "decided_on": "2026-08-06",
    "decided_by": {
      "name": "Komuro Ryuya",
      "github_login": "Ryuya-dot-com",
      "role": "package-maintainer"
    },
    "legal_basis": {
      "upstream_repository": "https://github.com/naist-nlp/tubelex",
      "pinned_license_url": "https://github.com/naist-nlp/tubelex/blob/7cb5fb36add76b83a266d1967536e1a1d3faa513/LICENSE",
      "upstream_readme_url": "https://github.com/naist-nlp/tubelex/blob/7cb5fb36add76b83a266d1967536e1a1d3faa513/README.md",
      "cran_policy_url": "https://cran.r-project.org/web/packages/policies.html",
      "license_spdx": "BSD-3-Clause",
      "interpretation": "The repository-level BSD-3-Clause license covers the repository-published frequency lists; the README separately withholds full corpus text while offering aggregate frequency lists for use."
    },
    "approved_scopes": {
      "redistribution_terms": true,
      "notice_and_attribution": true,
      "source_and_artifact_identity": true,
      "package_distribution_scope": true,
      "public_api_scope": true
    },
    "risk_controls": {
      "raw_subtitles_or_identifiers_included": false,
      "upstream_commit_and_source_hash_pinned": true,
      "bsd_notice_and_disclaimer_installed": true,
      "transformation_disclosed": true,
      "runtime_download_or_fallback": false,
      "independent_legal_opinion_obtained": false
    }
  },
  "remaining_gates_after_resource_approval": [
    "final release-candidate source, installed, and binary inventory audit"
  ]
}
